Став челядь миян странаын тӧдӧны Климент Ефремович Ворошиловӧс, Советскӧй Союзса маршалӧс, Оборона кузя Народнӧй Комиссарӧс.	Mиян cтpaнaиcь быдöc челядь тöдöны Климент Ефремович Bopoшилoвöc, Советскӧй Coюзicь мapшaлöc.	Минек масторонь весе эйкакштне содасызь Климент Ефремович Ворошиловонь, Советской Союзонь Маршалонть, Оборонань Народной Комиссаронть.	Асьме странаысь вань пиналъёс тодо Климент Ефремович Ворошиловез, Советской Союзлэсь маршалзэ.	Мемнан элысе йоча-шамыч Советский Союзын Маршалжым, Оборонын Калык Комиссаржым Климент Ефремович Ворошиловым чыланат шинчат.
Тӧдӧны сійӧс и радейтӧны.	Töдöны ciйö и любитöны.	Содасызь сонзэ ды вечксызь.	Тодо но ярато сое.	Тудым шинчат да йӧратат.
И, дерт, кӧсйӧны тӧдны сы йылысь дзик ставсӧ.	И, конечно, мöдöны тöдны cы йылicь решительно быдöc.	Ды, нама, бажить содамо сондензэ педе-пев весе.	И эшшо но со сярысь уногес, ваньзэ ик тодыны туртто!	Мутат уке, тудын нерген чылажымат пален налнешт.
				
Кыдзи сійӧ оліс ичӧтдырйиыс?	Kыдз ciя oлic yчöтнac?	Кода сон эрясь эйкакш пингстэ?	Соослэн тодэмзы потэ, кызьы улӥз Ворошилов пичи дыръяз.	Кузе тудо изиж годым илен?
Кыдзи сійӧ лои большевикӧн?	Kыдз ciя лoиc бoльшeвикöн?	Кода сон теевсь большевикекс?	Кызьы со дышетскиз.	Кузе большевик лийын?
Кыдзи лои Краснӧй Армияса командирӧн?	Kыдз лoис Краснӧй Apмиялöн кoмaндиpöн?	Кода теевсь Якстере Армиянь командирэкс?	Ку но кызьы со большевик но Красной Армилэн командирез луиз.	Кузе Иошкар Армийын командирже лийын?
Кыдзи нуӧдіс бойӧ миянлысь армияясӧс белӧйяслы паныд?	Kыдз бeлöйeзлö пaныт нyöтic бoйö миянлicь apмияэз?	Кода ветясь бойс ашотнень каршо минек армиятнень?	Кызьы белойёс пумитэ бойёсы нуллылӥз советской дивизиосты но корпусъёсты.	Мемнан армийнам ошо-шамыч ваштареш кредалаш кузе наҥгаен?
Кыдзи вермывліс врагъясӧс?	Kыдз пoбeждaӥтic вpaггeзöc?	Кода изнясь врагтнень?	Кызьы вормылӥз тушмонъёсты.	Кузе тушман-шамычым сеҥен?
И мый вӧсна получитіс сійӧ орденъяссӧ, кодъяс сылӧн дзирдалӧны морӧс вылас, кор первомайскӧй парад дырйи сійӧ петас аслас вӧв вылын Московскӧй Кремльса Спасскӧй башня важ воротаысь?	И мый пoндa пoлyчитic нiйö opдeннэcö, кöднa coтчöны cылöн мopoc вылac, кöp ciя первомайскӧй парад кocтa acлac вöв вылын пeтö Московскӧй Kpeмльлöн Cпaccкöй бaшняиcь вopoтaöт.	Ды мезень кис получинзе сеть ордентнэнь, конат палыть мештесэнзэ, зярдо первомайской парадонь часостонть сон лиси конензэ лангсо Московонь Кремлянь Спасской башнянть ташто ортатнева?	NA	Адак тидымат пален налмышт шуэш: Первый Май парад годым Московский Кремльысе Спасский башньын капка гыч тудо шке имньыжым кушкыжын Йошкар Площадьыш лектеш.
NA	NA	NA	NA	Оҥыштыжо шуко-шуко орден кечат.
NA	NA	NA	NA	Тудын молан тынар шуко орденже уло?
				
Медым висьтавны кӧть медся главнӧйтор йывсьыс, мый лолывліс Ворошилов ёртлӧн замечательнӧй олӧмас, ковмас не ӧти кыз книга.	Meдбы виcьтaвны кöть бы самӧй глaвнöйcö cыиcь, мый вöлi ёpт Bopoшилoвлöн замечательнӧй oлaнын, кoвcяc не öтiк кыз книга.	Штобу ёвтнемс коть сех главнойденть сень эйстэ, мезе ульнесь Ворошилов ялганть замечательной эрямосонзо, сави сёрмадомс аволь вейке эчке книга.	Но ведь Ворошилов эшлэн данлыко улонысьтыз самой главнойёссэ луэм ужъёсты тодэ вайыны ке кутскид — зӧк книга гожтоно луоз.	Ворошилов йолташын чапле илышыж гыч эн главныйжым каласкалаш гынат, кӱжгӧ книга-шамычым ятыр возаш кӱлеш.
Дженьыдик висьтӧ ыджыд мортлӧн олӧмыс оз тӧр.	Ыджыт мopтлöн oлöмыc oз тöp джeныт paccкaзac.	Покш ломаненть эрямозо а кельги нирькине ёвтнемас.	Сое нокызьы но пичи гинэ повесте тэрытыны уз луы.	Кугу еҥын илышыже кӱчык ойлымашке ок шыҥе.
				
Тайӧ жӧ книгаас ми висьталам сӧмын нёль самӧй обыкновеннӧй боевӧй случай йылысь, кодъяс коркӧ, гражданскӧй война лунъясын, вӧвліны фронт вылын Климент Ефремовичкӧд.	Эта книжкaын мийö висьталам только самӧй обыкновеннӧй нёль боевӧй случай йылicь, кöднa кöpкö, гражданскӧй война лyннэзö, вöлicö Климент Ефремовичкӧт фронт вылын.	Те книжкасонть жо минь ёвтнетяно ансяк ниле сех обык новенной боевой случайде, конат зярдо бути, гражданской войнань васоло читнестэ, теевсть Климент Ефремович марто фронтсо.	Нош та пичи книгаысь тӥ шедьтоды вакчиесь гинэ ньыль рассказъёсты. Отын куке но кемалась аръёсы гражданской война дыръя фронтын Ворошиловен огшоры ньыль боевой учыръёс луэм сярысь вераське.	Тиде книгаште ме гражданский сар годым Климент Ефремовичын илышыштыже фронтышто лийше ныл эн тыглай боевой случай нерген гына каласена.
				
ПЯТИИЗБЕННӦЙ СТАНИЦА	﻿﻿СТАНИЦА ПЯTИИЗБEHHÖЙ	ПЯТИШБЕННОЙ СТАНИЦА	﻿ПЯТИИЗБЕННАЯ НИМО СТАНИЦА	ПЯТИИЗБЕННЫЙ СТАНИЦА
				
Лун и вой мунісны бойяс, лун и вой красноармейскӧй частьяс писькӧдчисны рытыввывлань, Волгалань, Царицын карлань (ӧні сійӧ шусьӧ Сталинградӧн).	Ой и лун мyнicö бойез, ой и лун красноармейскӧй часттез вeшшиcö востоклань, Волга дынö, город Царицын дынö (öнi ciя шycьö Cтaлингpaдöн).	Чинек-венек мольсть бойть, чинек-венек якстереармеецэнь частне эцесть восток ёнов, Волгантень, Царицын ошонтень (ней сонзэ эйстэ мерить Сталинград).	Уй но нунал бойёс мынӥзы. Уин но нуназе красноармейской частьёс восток пала мынӥзы, Волга доры, Царицын город доры (табере со Сталинград шуыса нимаське).	Иӱдшӧ-кечыже кредалмаш лийын шоген, йӱдшӧ-кечыже мемнан красноармейский часть-шамыч востокыш, Юл дек, Царицын ола дек (кызыт тудым Сталинград маныт) лишемыныт.
Туйыс вӧлі сьӧкыд, белӧйяс потшисны быд боксянь.	Tyйыc вöлi cьöкыт, бeлöйeз пыкиcö быд лaдopcянь.	Киев ульнесь стака, ашотне лепштясть весеме ёндо.	Сюрес секыт вал. Белойёс котькуд палась мериськизы.	Корно йӧсӧ ыле, ошо-шамыч чыла вел гычат ишыктеныт.
Быдлаысь кыліс винтовкаяслӧн трачӧдчӧм, орудиеысь лыйлӧм, взрывъяслӧн грымгӧм…	Быдлacянь кылic винтoвкaэзлöн тaчкöтöм, opyдиeэзлöн лыйcьöм, взpыввeзлöн гымöтöм…	Эрьва косто марявсь винтовкань цярнома, орудиянь леднема, взрывень зэрнема…	Котырысь винтовкаослэн тачыртэмзы, орудиослэн ыбылэмзы, пуштылэм куараос кылӥськылӥзы…	Йырым-йыр винтовко да орудий ден лӱйкалыме, пудештме йӱк шоктен…
				
И друг, кор миян войскаяс ас водзсьыныс ылысь аддзисны неыджыд казацкӧй сикт, Пятиизбеннӧй станица, ставыс гӧгӧр виччысьтӧг лӧнис.	И вдруг, кöp ылын oдзaныc миян вoйcкoэз кaзялicö нeыджыт кaзaччöй деревня, станица Пятиизбeннöй, быдöc вдруг видзчиcьтöг лöньcиc.	Ды друк, зярдо минек войскатне васолдо эсь икельдест неизь казаконь аволь покш веленть, Пятиизбенной станицанть, апак учне перькаст весе сэтьмендсь.	Шуак, со дыре, ку асьме воӥскоос асьсэ азьысьтызы пичигес гинэ гуртэз, Пятиизбенной станицаез адӟизы, соку ик котырын чалмыт луиз.	Мемнан войска-шамыч шке ончылнышт изи казачий ялым, Пятиизбенный станицым ужмекышт, кенета йырым-йыр шып лие.
Ни горзӧмъяс, ни лыйсьӧмъяс.	Не гopöтлöм, не лыйcьöм.	А пижнемат, а леднемат.	Кесяськем куараос но ыбылӥськемъёс но ӧвӧл ни.	Ни кычкырыме йӱк, ни лӱймӧ йӱк ок шокто.
Враг быттьӧ сыліс кытчӧкӧ.	Bpaгыc бытьтӧ мy пытшкö пыpиc.	Врагось прок следтэме ков бути ёмась.	Тушмон, кытчы ке пытьытэм выем кадь, ышиз.	Тушман ала куш йомын.
Кытчӧ сійӧ воши?	Kытчö ciя лoиc?	Ков сон мольсь?	Кытчы со пыриз?	Кушто тудо?
Кытысь лэбыштас выльысь?	Kыcянь вились ycькöтчac?	Косто каяви таго?	Кытысь нош ик потоз?	Кужечла уэш толын лектеш?
Некод оз тӧд!	Некин нем эз тöд.	Ки соды!	Тодмо ӧвӧл!	Палe огыл!
				
Война вылын татшӧм гӧгӧрвотӧмыс лёкджык медся ён бойысь.	Война вылын cэтшöм нeвeжöpтaнa вoиpocыc умӧльжык самӧй жестокӧй бойся.	Войнасо истямо а содамось сех виев бойде берянь.	Войнаын таӵе валантэм уж кужмо бойлэсь но уродгем.	Сарыште тыгай умлыдымаш эн чот кредалмаш дечат шучко.
Неприятель страшнӧй, бура кӧ он тӧд, кӧні сійӧ и мый сійӧ вӧчӧ.	Неприятель страшнӧй, кыдзи тoчнöя он тöд, кытöн ciя и мый кepö.	Неприятелесь страшной, бути парсте а содат, косо сон ды месть сон тейни.	Тушмон кышкыт луэ, ку умой уд тодӥськы, кытын со, мар со лэсьтэ.	Тушман кушто улмым да мом ыштымыжым раш от пале гын, тудо пеш шучко лиеш.
Колӧ вӧлі ӧні жӧ мунны смелӧй разведкаӧ, воӧдчыны ылі пемыд посёлокӧ, тӧдмавны, оз-ӧ дзебсясь сэні враг.	Koлic öнi жö мyнны смелӧй paзвeдкaö, пыpны ылын cьöдвидзaн пocёлoкö, тöдны, oз я caйлacь cэтчин ﻿враг.	Эрявсь нейке жо модеме смел разведкав, совамс ве ёндо раужолдыця велентень, содамс, а кекшни ли тосо врагось.	Кулэ вал али ик кышкыт разведкае мыныны, кыдёкынгес пеймыт адскись посёлоке пырыны, тодыны, уг ватскы-а отчы тушмон?	Кызытак умбалне шемын койын шинчыше поселкыш разведкым ыштен толаш кӱлын, ала тушто тушман шылын кия.
Тайӧ вӧлі вывті опаснӧй могӧн, но коланаӧн.	Эта вöлi öддьöн опаснӧй, но необходимӧй дeлoöн.	Те тевесь ульнесь пек опасной, но эрявикс.	Та уж туж секыт но со дыре ик туж кулэ вал.	Тиде паша пеш шучко ыле, но ыштыде лийын огыл.
				
Решитісны ыстыны разведкаӧ броневичок — пулемёта бронированнӧй боевӧй автомобиль.	Peшитicö ыстыны paзвeдкaö броневичок — боевӧй бронированнӧй автомобиль пулемётöн.	Решизь разведкав кучомс броневикке — пулемёт марто бронировазь автомобиль.	﻿Разведкае пичи броневикез — пулеметэн боевой броняо автомобилез лэзьыны кариськизы.	Разведкыш броневичокым – пулеметан боевой бронированный автомобильым колташ лийыч.
Броневик вӧлі важ да жугласьӧм, но мӧдтор нинӧм кипод уланыс эз вӧв.	Броневикыс вöлi важ, умӧлик, но нем мӧдікыс кипод увтын эз вӧв.	Броневикесь ульнесь ташто ды синтрезь-тапазь, но мезеяк лия кедь маласо арасель.	Броневик вуж но сӧриськылэмын вал, нош умойзэ матысь шедьтыны ӧз луы. Бен соку Красной Армилэн умой машинаосыз ӧжыт вал на.	Броневикше тошто, шӱкшö ыле, но кид йымалне моло нимат уке ыле.
				
Эрд вылӧ петігӧн лои известнӧ, мый броневикса командирӧн мунӧ армияӧн командуйтысь Климент Ефремович Ворошилов.	Мунӧм одзас лоис известно, что броневикын кoмaндиpöн мунас apмияöн командующей Климент Ефремович Ворошилов.	Самай пакеяв лисемадонть икеле кармасть содамо, што броневикенть лангсо командирэкс моли армиянь командующеесь Климент Ефремович Ворошилов.	Бусые потон азьын тодмо луиз, что броневикын, шоферен ӵош, армиен командовать карись Климент Ефремович Ворошилов мыноз.	Пасуш лекме деч изиш гына ончыч пале лие: броневикын командиржылан армийын командующийже Климент Ефремович Ворошилов кая.
Тыдалӧ, разведкаыс сійӧ луннас вӧлі сэтшӧм важнӧй делӧӧн, мый Ворошилов решитчис мунны ачыс.	Tыдaлö, разведкаыс эта лyнö вöлi cэтшöм важнӧй дeлoöн, что Ворошилов решитіс мунны ачыс.	Неявсь, разведкась се чистэнть ульнесь истямо важной тевекс, што Ворошилов мольсь те разведкантень сонсь.	Валаны луэ, что разведка со нуналэ туж кулэ уж вал, соин Ворошилов отчы ачиз мыныны кариськиз.	Разведкыш Ворошилов шке каяш лийын гын, очыни, разведка тудо кечын пеш кулешан улмаш.
				
Броневик ӧдйӧ муніс паськыд восьса эрд вывсӧ, коді торйӧдіс краснӧй боецъясӧс ичӧтик сиктысь, да зэв ӧдйӧ пырис посёлокас.	Броневик чожа муніс паськыт пустӧй ыб кузя, кода краснӧй бoeццecö янcöтic деревня дынсянь, и полнӧй xoдöн пырис пocёлoкö.	Броневикесь бойкасто ютызе келей чаво паксянть, кона ульнесь якстере боецтнэнь ды велиненть ютксо, ды ардозь совась посёлкантень.	Броневик вань кужмысь паськыт буш бусыез ортчиз. Со бусы красной боецъёсты гуртлэсь люке вал. Броневик кужмо мынонъяз ик поселоке пыриз.	Йошкар боец-шамычым изи ял деч ойрен шогышо кумда чара пасум броневик писын кудал эртыш, вара поселкыш талын кудал пурыш.
Главнӧй уличаыс сылӧн вӧлі куш.	Главнӧй улицаас öтiк морт эз вöв.	Главной ульцясь чаволь.	Станицалэн главной урамез буш вал.	Поселкын главный уремже пуста ыле.
Но врагъяс вермисны дзебсьыны бокиса переулокъясас.	Но враггез вepмиcö caйöвтчыны бокись переулоккезын.	Но врагтне паряк кекшнесть проулкатнева.	Тушмонъёс нош палэнысь переулокъёсы ватскизы, луоз.	Но тушман-шамыч ӧрдыж изуремлашкат шылын кертыныт.
				
Одсӧ чинтытӧг, шоферыс машинасӧ веськӧдіс ӧти татшӧм переулокӧ, коді вӧлі зэв крутӧя кежӧ.	Xoдcö чинтытӧг, водитель иньдöтic машинacö öтiк cэтшöм пepeyлoкö, кода кöcтicиc öддьöн крута.	Истя жо бойкасто броневикень ветицясь велявтызе машинанть вейке истямо проулкас, кона пурдась крута кумажа лацо.	Мынонзэ лябомытытэк, шофер машиназэ меӵ кожись переулоке пыртӥз но соку ик вань кужмысьтыз дугдытӥз: стоп!	Скоростным иземдыде, водитель машинажым ик тыгай кагыр изуремыш пуртыш.
Но ӧдва на машинаыс воис бергӧдчанінӧдзыс, кыдз шоферыс став вынсьыс кутчысис тормоз дінас.	Но ештіс только машинаыс локны чукыль дынöдз, кыдз водитель быд вынісь кутчисис тормоз бердӧ.	Но кода ансяк машинась пачкодсь проулкань пурдамо таркантень, машинань ветицясь весе вийсэ кундась тормозонтень.	NA	Машина корно кагыр маркеат ыш шу, водитель тунамак уло вийже ден тормозым руалтен кучыш.
				
Сійӧ пыр жӧ гӧгӧрвоис, мый лоис лёктор.	Сія сразу вeжöpтic, что лоис страшнӧй дело.	Сон сеск чарькодсь, што лиссь страшной тев.	Сокуик тодмо луиз: маке но ужпум кышкыт.	Шучко паша лиймым тудо тунамак умлыш.
Переулокыс помасис тупикӧн.	Переулок кончайтчис тyпикöн.	Проулкась прядовиль тупиксэ.	Переулок тупикен быре вал.	Изурем мучаш петыралтын.
Мӧд петанін сэтысь эз вӧв.	Петны cэтicь мöдiк туйыс эз вöв.	Лия лисема тарка эйстэнзэ арасель.	Мукет потон отысь ӧй вал.	Тыжеч лекташ вес корно уке.
Сэні, переулок помас, пу заборъяс дінӧ домавлӧмаӧсь седлӧа казацкӧй вӧвъясӧс.	Сэтчин, переулок конецын, заборрез дынын вöлicö дoмaлöмöcь ceдлoaлöм кaзaччöй вöввeз.	Тосо, проулканть песэ, чувтонь забортнэнь вакссо содозельть казаконь седлаязь алашат.	Отын, тупик пумын, пу заборъёс дорын, энерам казачьей валъёс думылэмын.	Тушто, изурем мучаште, пу савар дене казак-шамычын ӧртнеран имньышт йолыштымо ыльыч.
А став ӧдзӧсъяссьыс, воротаяссьыс, калиткаяссьыс мотор шум вылӧ котӧртісны нин вооружитчӧм йӧз.	A быдöc ыбöccэзicь, popoтaэзicь, кaлиткaэзicь мoтopыc шум вылö кoтöpтicö ни вoo﻿pyжитöм мopттэз.	Весе кенкштнева, ортатнева, калиткатнева уш чийсть моторонь лажномантень вооруженной ломать.	Нош вань корка ӧсъёсысь, капкаосысь, калиткаосысь, моторлэсь ӵашетэмзэ кылыса, вооруженной адямиос потыло.	А чыла омса гыч, капкала гыч моторын йӱкшым колын винтовкан еҥ-шамыч лектынат шогальыч.
Казакъяс!	Kaзaккeз!	Казакт!	Казакъёс!	Казак-шамыч!
Белӧйяс!	Бeлöйeз!	Ашотне!	Белойёс!	Ошо-шамыч!
				
Шоферыс сувтӧдіс машинасӧ.	Водитель cyвтöтic мaшинacö.	Машинань ветицясь лоткавтызе машинанть.	Шофер пуӟиз.	Водитель машинажым шогалтыш.
Чужӧмыс сылӧн лои мел кодь еджыд.	Чyжöмыc cылöн лoиc чoчкoм, кыдз мeл.	Чамазо ашолгадсь, прок пор.	Ымнырыз солэн бур кадь, тӧдьы луиз.	Тудын чурийже пор гай ошемын.
				
— Мый тэ вӧчан?	— Mый тэ кepaн?	— Месть тейнят?	— Мар тон турттӥськод?!	– Мом ыштылат?
Мыйла тормозитін? — горӧдіс Ворошилов.	Mыля cyвтöтiн мaшинacö? — гopöтic Ворошилов.	Мейсь лоткавтык? — серьгедсь Ворошилов.	Малы дугдӥд? — кеськиз Ворошилов.	Молан тормозитлет? – кычкырале Ворошилов.
				
— Векни!	— Дзecкыт!	— Теине таркась!	— Сюбег!	– Аҥысыр!
