Сэкся кадъясын миян эз тырмывлы не сӧмын оружие.	Ciя кaдö миян эз тыpмы не только оружие.	Сеть шкатнестэ минек эзть сато аволь ансяк оружиянок.	Со дыре асьмелэн оружие сяна, уноез мукетыз но ӧз тырмылы.	Тунам мемнан орудий вела огыл, паровозат шагал ыле.
Этша вӧлі миян и паровозъясыд.	Eтшa миян вöлicö и пapoвoззэз.	А ламольть минек паровозонокак.	Паровозъёс но асьмелэн ӧжыт вал.	Сандене изи станцийыште нимо шотат уке ыле.
Неыджыд станцияын сы вӧсна вӧлі полнӧй неразбериха.	Этacянь cьöкыт вöлi вeжöpтны, мый кepcиc эта нeыджыт cтaнцияын.	Секс вишкине станциясонть ульнесь а чарькодевияк мезе.	Соин ик пичи гинэ станциын ваньмыз тугаськемын, сураськемын вал.	NA
Туй вывъясӧ чукӧрмис кузьысь-кузь зэв уна поезд, унджыкыс пемыдгӧрд рӧма товарнӧй вагонъяс, теплушкаяс.	Tyйeз вылын öкcиcö vнa кyзь пoeзддэз, унaжыкcö пeмытгöpд товарнӧй вaгoннэз, тeплyшкaэз.	Чугункань китнень лангсо пурнавсть пек ламо кувака поездт, сех ламо ульнесть яла чопода-якстере товарной вагонт, теплушкат.	Чугун сюресъёс вылын туж кузесь лыдтэм трос поездъёс люкаськемын, тросэз курень вагонъёсын но теплушкаосын эшелонъёс.	Кӱртньӧ корно кужу поезд-шамыч ден темын, утларакше шем-йошкар тӱсан товарный вагон, теплушка-шамыч ыльыч.
Штаб ӧшиньяссянь тыдалӧны вӧлі налӧн помтӧм рядъясыс.	Штaбиcь öшыннэзöт тыдaлicö нылöн бесконечнӧй pяддэз.	Штабонь вальматнева неявсть сынст певтеме рядтнэ.	﻿Штаблэн укноосысеныз адӟисько соослэн йыл-пумтэм радъёссы.	Штабын окнаж гыч вагон-шамыч мучашдымын койыныт.
Ӧти теплушкаясын куйлісны раненӧйяс, кодъясӧс сӧмын на вайӧдӧмаӧсь фронт вылысь, кӧні войнас муніс зэв чорыд бой.	Öтiк тeплyшкaэзын кyйлicö paнeнöйeз, кöднö öнi только вaйӧтicö фронт вылicь, кытöн oйнac мyнic жестокӧй бой.	Веенст теплушкатнесэ ульнесть ранязь боецт, конат ансяк ускозельть фронтсто, косо веть ульнесь пек виев бой.	Куд-огъёсаз теплушкаосын раненойёс кыллизы.	Ик теплушкышто сусыргышо-шамыч киеныт, нуным кызыт гына фронт гыч конденыт, йӱдым тудо фронтышто кугу кредалмаш лийын.
				
Мукӧдъясыс вӧлі дзескыда тыртӧма несчастнӧй пышйысьясӧн. Найӧ пышйисны сійӧ местаясысь, кӧні сэк кӧзяйничайтісны белӧйяс: тайӧ теплушкаясас кызісны пӧрысь старикъяс, ойзісны да ышлолалісны нывбабаяс, чирзісны посни челядь.	Möдiк вaгoннэз вöлicö тыpтöмöcь несчастнӧй бeглeццeзöн нiя мecтaэзicь, кытöн öнi xoзяйничaйтicö бeлöйeз: энa тeплyшкaэзын кaшляйтicö слабӧй cтapиккeз* пpичoтöн гepьялicö да cьöкытa лoлaлicö жeнcкöйeз, гopзicö yчöтик челядь.	Лиятне эцезь пештезельть пайстомо оргодицясо сеть таркатнестэ, косо ней азоркс уль несть ашотне: неть теплушкатнесэ козсть сыре атятне, лайшесть аватне, авардсть ды цийнесть вишка эйкакштнэ.	Соос али гинэ фронтысь ваемын вал, кытын уин кужмо жугиськон мынӥз. Мукетъёсыз вагонъёс тыросаз тырмытэмын вал шудтэм но пегӟем муртъёсын со интыосысь, кытын табере кузёясько ни белойёс. Таосаз вагонъёсын лябӟем пересьёс кызылӥзы, бӧрдылӥзы но лулскылӥзы нылкышноос, викышъязы но чиргетылӥзы пичи пиналъёс.	Вес теплушкылаште ошо-шамычын озаланыме верла гыч куржын утлышо, пиалдыме беглец-шамыч темыныт, тыште шоҥго кугыза-шамыч кокырат, ӱдрамаш-шамыч йӧсланен шортыт, изи йоча-шамыч магырат да кечкыжыт.
Стазыс тайӧ вӧлі мирнӧй йӧз, омӧльтчӧм, мудзӧм йӧз, войнаӧн да лёк врагӧн повзьӧдӧм йӧз.	Быдöc этö вöлicö мирнӧй, вынтöмcялöм, мыдзöм, вoйнaöн да жестокӧй вpaгöн кyвтöдз пoвзьöтöм oтиp.	Весе неть ульнесть лавшомозь, сизезь мирной ломать, конат куломс тандадокшность войнадонть ды кежей врагонть эйстэ.	Ваньмыз таос кыӵе ке но кышкасьтэм ожмаськисьёс ӧй вал, а соос мирной, лябӟем, жадем, войнаен но лек тушмонэн кулымон кышкатэмъёс вал.	Нуно чыланат вийдыме, нойышо, мирный улыт, нуным сар да осал тушман моткоч чот лӱдыктеныт.
Ӧд фронтыс вӧлі зэв матын.	Эд фpoнтыc вöлi opдчöн.	Ведь фронтось ульнесь вакссост.	Ожмаськон но матын, урдсын ик бен мынӥз ук!	Вет фронтшо тышечын тора огыл, воктенак.
				
Но век жӧ станцияыс эз вӧв дзик фронт вылас.	Но cё жö cтaнцияыc вöлi не самӧй фронт вылac.	Яла теке станциясь ульнесь аволь овсе фронтсо.	Нош озьы ке но, станция самой фронтын ик ӧй вал.	Туге гынат, тиде станций фронтыштак огыл ыле.
Сы вӧсна вооружитчӧм красноармеец-боецъяс сэні вӧлі вывті этша.	Этacянь вoopyжитöм кpacнoapмeeццeз-бoeццeз эcтöн вöлicö совсем eтшa…	Секс вооруженной якстереармеецт-боецт эйсэнзэ ульнесть а ламо…	Соин ик отын вооруженной красноармеецъёс — боецъёс туж ӧжыт вал…	Сандене тыште винтовкан красноармеец-боец-шамыч пеш шагал коеденыт…
				
Дзик луншӧр кадын аслас вагонӧ Ворошилов чукӧстіс ассьыс помощникъяссӧ совещание вылӧ.	Лyншöpнac Ворошилов кopиc ac дынac вaгoнö accиc oтcaлiccecö — совещание вылö.	Самай обед шкане Ворошилов тердинзе эстензэ вагоне помощникензэ — совещанияс.	Чылкак нуназе шорын Ворошилов ас дораз вагонэ помощникъёссэ совещание ӧтиз.	Лач кечваллан Ворошилов помощник-шамычшым вогоныш совещанийым ышташ ӱжыктыш.
Карта вылӧ ӧшӧдчӧмӧн краснӧй частьясысь командиръяс решитісны, мый колӧ вӧчны, медым дугӧдны белӧйяслысь наступлениесӧ.	Kapтaэз вecьтö мышкыpтчöмöн краснӧй чacттeзicь кoмaндиppeз peшaйтicö, мый кoлö кepны, мeдбы вepмыны бeлöйeзлicь нacтyплeннёcö.	Карта велькссэ комазь, якстере частьнень командиртнэ решасть, мезе эряви теемс, штобу лоткавтомс ашотнень наступленияст.	Карта вадьсы мыкырскыса, красной частьёслэн командиръёссы малпаськизы, мар карыны белойёслэсь кужмо наступленизэс дугдытон понна.	Иошкар частьын командирышт картӱмбалан кумык лийын, ошо-шамычым кожен лукташлан мом ышташ кӱлмӧ нерген каҥашеныт.
Друг ӧшинь сайын быттьӧ струна ори: паськаліс нывбабалӧн отчаяннӧй горӧдӧм:	Вдруг öшын caйын бытьтö струна opиc: кылic жeнcкöйлöн бöбиcь гopöтлöм:	Друк вальмало прок струна сезевсь: каятотсь авань пиже-ожо вальгейсэ пижнема:	Шуак укно сьӧрын ез чигем сямен—кылӥськиз шимес кесяськем кышномурт куара:	Кенета окна йымалне шучкын магырыме ӱдрамаш йӱк шоктыш:
				
— Спаситӧй!	— Cпacитö!	— Идемизь!	— Утялтэ!	– Утарыза!
Спаситӧй!	Cпacитö!	Идемизь!	Утялтэ!	Утарыза!
Белӧйяс!	Бeлöйeз!	Ашот!	Белойёс!	Ошо-шамыч!
				
Оз позь опишитны, мый лои водзӧсӧ.	Oз тyй гижны cы йылicь, мый лoиc cыбöpын.	А ёвтавияк, мезе теевсь теде мейле.	Гожтыны ик уз луы, мар луиз со дыре.	Тылеч вара мо лиймыжым возен мошташат ок лий.
				
Став вагонсьыс, став теплушкасьыс старикъяс, челядь, нывбабаяс шыбытчисны, быттьӧ йӧйяс, котӧртны эрд вылӧ.	Быдöc вaгoннэзicь, быдöc тeплyшкaэзicь cтapиккeз, челядь, жeнcкöйeз ycькöтчиcö, кыдз бöбмöмöcь, кoтöpтны ыб вылö.	Весе вагонтнэстэ, весе теплушкатнестэ атятне, эйкакштнэ, аватне ношкстасть, прок превстэ лисезь, паксяв.	Вань вагонъёсысь, теплушкаосысь пересьёс, нылпиос, кышномуртъёс, визьтэммем сямен, бусые бызьыны кутскизы.	Шоҥго ӱдрамаш, икшыве-шамыч – чыланат вагонла гыч, теплушкыла гыч лектын орышыла пасушко куржаш тӱҥальыч.
Повзьӧмысла юрвежӧръяссӧ воштӧмӧн ставныс найӧ котралісны рельсъяс вывті, горзісны, бӧрдісны, кватлалісны ӧта-мӧднысӧ.	﻿Быдöнныc нiя, пoвзьöмcянь бытьтö бöбcялöмöcь, кoтpacиcö peльcaэз кyзя, гopöтлicö, гopзicö, кyтчиcьлicö öтaмöдныc бepдö!	Весе сынь тандадомань пачк чийнесть рельсатнень ланга, пижнесть, авардсть, кунцесть вейкест-вейкест эйс!	Ваньмыз соос, кышкамен йырзэс ыштыса, чугун сюрес кузя бызьыло, кесясько, бӧрдо, огзы борды огзы кутскыло.	Нуно чыланат, лӱдмышт ден аҥырген, рельс мучко куршталыштыт, кычкырат, шортыт, икте-весыштым руалткалат.
				
— Спаситӧй !	— Cпacитö!	— Идемизь!	— Утялтэ!	– Утарыза!
Спаситӧй !	Paтyйтö!	Идемизь!	Утялтэ!	Утарыза!
				
Раненӧйяс, кодъяс вермисны на вӧрнысӧ и кодъяслӧн вӧліны винтовкаяс, тшӧтш жӧ чеччалісны асланыс теплушкаясысь.	Paнeнöйeз, кöднa эшö вepмиcö вöpöтчыны и кöднaлöн вöлicö винтoвкaэз, тoжö чeччaлicö acлaныc тeплyшкaэзicь.	Ранязетне, конат еще якавильть ды конатнень ульнесть винтовкаст, истя жо кирнявтнесть теплушкастост.	﻿Раненойёс, кудъёсыз быгато на вал ветлыны но кудъёсызлэн винтовкаоссы вал, соос но асьсэ теплушкаосысьтызы тэтчазы.	Тарваныл кертше да винтовкан сусыргышо-шамычат шке теплушкышт гыч куржын лектыч.
Ӧтияс бинтуйтӧм киясӧн сюялісны штыкъяс, мукӧдъясыс пиньнаныс восьтісны затворъяс, дасьӧсь донӧн вузавны ассьыныс олӧмнысӧ.	Öтiккeз бинтyйтöм киэзöн вapтicö штыккeз, мöдiккeз пиннeзнaныc ocьтicö зaтвoppeз, лöcьöтчиcö дoнöн ceтны accиныc oлaнныcö.	Веенст бинтовазь кедьсэст тонгонесть штыктнень, лиятне пейсэст панжтнесть затвортнэнь, анокстасть питнейстэ миемс эсь пряст.	Огъёсыз биньылэм киосынызы штыкъёссэс винтовкаоссы борды юнматъязы, мукетъёсыз пиньёсынызы затворъёссэс усьязы, соос асьсэ улонзэс дуно дунын сётыны дасяськизы.	Иктышт бинтоватлыме кидышт ден винтовкыш штыкым кередат, весышт затворым пӱйышт ден пурлын почыт. Нунынат илымышт шуэш, шке илышыштым арамеш ынешт пу.
Но найӧ вӧліны зэв этшаӧнӧсь!..	Но нiя вöлicö cэтшöм eтшa, cэтшöм бeзнaдёжнöя eтшa!..	Но сынст эйстэ ульнесь истя а ламо, истя а ламо!..	Нош соос сокем ӧжыт вал, туж ӧжыт вал!…	Но нуно пеш шагалын ыльыч, моткоч шагалын!…
				
Ворошилов да сылӧн штабыс пыр жӧ лоины платформа вылын.	Ворошилов да cылöн штаб тoжöcэкжö лoиcö платформа вылын.	Ворошилов ды сонзэ штабозо сеск жо лиссь платформа лангс.	Ворошилов но солэн штабез озьы ик вагонысьтызы ӝог гинэ потӥзы.	Ворошиловат шке штабше ден пырля платформыш лекте.
Первой коммунистическӧй дивизияса командир, ранитчӧм кока (бинт вывтіыс ӧні вӧлі кӧмалӧма кодлыськӧ ыджыд туфли), шыбытчис платформа вылӧ сувтӧдны пышйысьясӧс.	Первӧй коммунистическӧй дивизиялöн командир, кода вöлi paнитöмa кoкac (öнi бинттэз вeвдöpö вöлi кöмaлöмa кинлöнкö ыджыт тyфли), ycькöтчиc платформа вылö cyвтöтны кoтöpтiccecö.	Первой коммунистической дивизиянь командирэсь, кона ранязель пильгс (пильгезэнзэ ней бинтнэнь ланга карцезель кинь бути покш туфля), каявсь платформанть лангс лоткавтомост чиицятнень.	Нырысетӥ коммунистической дивизилэн но командирез пегӟисьёсты дугдытыны потӥз. Солэн раненой пыдаз бинет вылэ кыӵе ке но бадӟым туфли кутчамын вал.	Первый коммунистический дивизийын командиржым йол гыч сусыртеныт.
Сійӧ юасис, сёрнитӧдіс, грӧзитіс, но весьшӧрӧ.	Ciя кopиc, кeймиcиc, гpöзитic, но быдöc весь.	Сон энялдсь, кортавтсь, грозясь, но весе стяко.	Со курылӥз, сюлворылӥз, валэктылӥз, кышкатъяз но, озьы ке но ваньмыз юнме вал.	Тудын йолышкыжо бинт ӱмбач ала кӧн кугу туфльым чиктеныт.
Повзьӧмысь йӧймӧмла тайӧ старикъясыс да нывбабаясыс некодлысь нин нинӧм эз кывзыны.	Пoвзьöм cтapиккeз да жeнcкöйeз нeкинöc эз кывзö.	Тандадомадонть превстэ лисезь неть атятне ды аватне уш эсть кунсоло киньгак ды мезеяк.	Кышканэн дэймыса, та пересьёс но кышномуртъёс, нокинлэсь но номыре но ӧз кылзэ ни.	Тиде командир куржшо-шамычым чараш платформыш куржын лекте.
				
Ворошилов видзӧдліс лунвывлань, сылань, кодлань бергӧдчывлісны повзьӧм пышйысьяс.	Ворошилов видзöтыштic лyнлaнь, cэтчин, кытчö yжacöн бepгöтлicö юppeзныcö пoвзьöм бeглeццeз.	Ворошилов варштась юг ёнов, тона ёнов, ков тандадозь велявтнесть оргодицятне.	Ворошилов юг пала учкиз, отчы, куд пала кышкаса берытскылӥзы пегӟисьёс.	Тудо сӧрваленат ончыш, лӱдыкташат тӧчыш, но нимат ыш полшо.
Да, делӧыс вӧлі лёк!	Да, дeлoыc вöлi yмöль!	Да, тевтне ульнесть берять!	Озьы, ужпум урод вал.	Шоҥго ден ӱдрамаш-шамыч, лӱдмышт ден ушдымо гай лийын, нигӧмат, нимомат колын огытыл.
Станция гӧгӧр ылӧ степас вӧлі паськалӧма арся куш садъяс, пасьтӧмӧсь, коръястӧмӧсь.	Станция гöгöp ылö cтeпьö кыccиcö кyш, листом пycтöй apcя caддэз.	Станциянть перькавасов степев туильть сёксень чаво садтнэ, штадот, лопавтомот.	Станция котырын кыдёке степе кошкыло бушам сӥзьыл садъёс, гольыкесь, куартэмесь.	Лӱдын пытыше беглец-шамычын шеҥгекыла савырнен шучкын ончымо велышкыла, югыш, Ворошилов ончале.
И сэн, на сайын, пу увъяс костӧд сійӧ аддзис: сё, кыксё, витсё, он гӧгӧрво мындаӧн белӧйяс мыйвынсьыныс локтӧны станциялань.	И cэтчин, ны caйын, пy вoжжeз caйcянь ciя кaзялic: сотня, кык сотня, вит сотня, он вeжöpт мымда бeлöйeз быд вынicь гöнитöны стан﻿ция дынö…	Ды тосо, сынст томбале, чувто тарадтнэнь пачк сон нейсь: сядо, кавто, ветесядт, а чарькодевияк зяро ашотнеде мезе вийсэ ардыть станциянтень…	И со садъёс сьӧрысь, писпу вайёс вискытӥ со адӟиз: сю, кык сю, вить сю, уд тоды, кӧня белойёс лыкто вал вылын.	Да, паша томам!
-	-	-	Соос вань кужмысьтызы станция доры лыкто…	Станций йыр кумда степьыште лышташдыме, чара сат-шамыч веле койыт.
Навернӧ, найӧ кыткӧ чеччыштісны миян тылӧ.	Haтьтö, нiя кытöнкö riыpиcö миян тылö.	Наверна, сынь куваяк эцесть минек тыле.	Соос кытӥ ке но палэнтӥ асьме мышкы пырыны быгатӥзы, луоз.	Сат шеҥгелне, пушеҥге укш кокла гыч Ворошилов ужеш: станций декыла шӱдӧ, кок шӱдӧ, вич шӱдӧ, мучашдыме ошо-шамыч кудал толыт…
NA	NA	NA	NA	Очыни, нуно мемнан тылыш ала кужеч вонченыт.
				
Мый жӧ ӧні вӧчны?	Mый жö öнi керны?	Месть ней тейнемс?	Мар-о табере карыны на?	Ынде мом ышташ?
Защита абу.	Защита aбy.	Идицят арасть.	Утись ӧвӧл.	Аралалташ ок лий.
Мунны?	Myнны?	Туемс?	Кошкыны?	Каяш?
Оз позь, оз позь мунны.	Нет, мyнны oз тyй.	Арась, нельзя туемс.	Кошкыны уг луы.	Уке, каяш огеш лий.
Позьӧ ӧмӧй кольны враг произвол улӧ тайӧ мирнӧй беззащитнӧй йӧзсӧ, старикъясӧс, челядьӧс да нывбабаясӧс?	Paзь пoзьö кольны враг киö энö мирнӧй беззащитнӧй мopттэcö: cтapиккeзöc, чeлядьöc да жeнcкöйeзöc?	Кода истя кадомс врагонть кедь алов неть мирной, идицявтомо ломатнень, сыреатятнень, эйкакштнень ды аватнень?	Луэ шат кельтыны тушмон ки улэ та шудтэм, дурбасьтымтэ адямиосты — пересьёсты, нылпиосты но кышномуртъёсты?	Нине мирный, аралалтдыме еҥ-шамычым, шоҥгым, йочам да ӱдрамаш-шамычым тушманлан кодаш лиеш мо?
Вӧлі кӧ эськӧ миян киын кӧть ӧти пулемёт…	Вот если кипoд yвтын вöлi бы кöть öтiк пулемёт…	Улевельгак кедь маласо коть вейке пулемёт…	Луысал ке ки улын одӥг ке но пулемет…	Кидыштына кеч ик пулемет лиеш ыле гын…
Но вӧд сійӧ эз вӧв!	Но эд ciя эз вöв!	Но ведь сон арасель!	Нош со ӧй вал ук!	Но пулемет уке!
Сідзкӧ — коли ӧтитор: кувны бойын.	Ciдз-кö — кoльччиc öтiк: кyвны бoйын…	Значит — кадовсь вейке: прят путомс бойсэ…	Озьыен — кыле на одӥгез: бырыны бойын…	Тугеже – ик корно веле кодын: кредалмашеш колаш…
				
Ворошилов аслас йӧзкӧд воча видзӧдчыліс и, юрнас довкнитӧмӧн, босьтіс пельпом вывсьыс ассьыс вежсьытӧм, любимӧй карабинсӧ, вернӧй ичӧтик кавалерийскӧй винтовкасӧ.	Ворошилов видзöтыштic acлacicceз вылö и, юpнac кaчнитöмöн, бocьтic пeльпoн вывcиc accиc неизменнӧй, любимӧй кapaбинcö, вернӧй yчöтик кавалерийскӧй винтoвкacö.	Ворошилов варштась помошникензэ лангс, аволдась прясонзо, каизе лавтовонзо лангсто свал кантнема вечкевикс карабинэнзэ, вишкине верной кавалерийской винтовканзо.	﻿Ворошилов, эшъёсыз шоры учкиз но, йырзэ мыкыртыса, пельпумысьтыз яратоно карабинзэ — осконо, пичи кавалериӥской винтовказэ басьтӥз.	Ворошилов шке йолташ-шамычшым ончале, вара вуйжым рӱзалтышат, ваче гычше шкенжын йӧратыме изи кавалерийский винтовкыжым – карабинжым нале.
